{
  "$schema": "https://changesaga.dev/schema/v5/relation.schema.json",
  "version": 5,
  "id": "coverage-human-addresses-readable",
  "type": "addresses",
  "from": "urn:change-saga:app:fragment:coverage-report-contract:landmark:human-reading-contract",
  "to": "urn:change-saga:app:story:coverage-report:criterion:human-readable",
  "scope": "self",
  "rationale": "The primary report is designed to be understandable without processing structured output.",
  "to_revision": "urn:change-saga:app:story:coverage-report:revision:r3",
  "from_content_digest": "sha256:65d4f88fa96e421b3feb5c02a3891a97a353d2cff5d4d8b057ffd36b21b2bf08",
  "state": "active",
  "created_at": "2026-09-21T04:52:55.776444Z"
}
