{
  "$schema": "https://changesaga.dev/schema/v5/relation.schema.json",
  "version": 5,
  "id": "test-review-raster-html-sandbox-69a431ba2111",
  "type": "verifies",
  "from": "urn:change-saga:change-saga:test-case:review-raster-html-sandbox",
  "to": "urn:change-saga:change-saga:story:visual-technical-explanation:criterion:media",
  "scope": "self",
  "rationale": "Steps raster, sandbox define how this criterion is checked. Implementation links describe only the code they cite; this relation makes no execution claim.",
  "from_revision": "urn:change-saga:change-saga:test-case:review-raster-html-sandbox:revision:r1",
  "to_revision": "urn:change-saga:change-saga:story:visual-technical-explanation:revision:reading-20261016",
  "state": "active",
  "created_at": "2026-10-16T23:22:23.075086Z",
  "request_id": "test-review-raster-html-sandbox-69a431ba2111"
}
