{
  "$schema": "https://changesaga.dev/schema/v5/relation.schema.json",
  "version": 5,
  "id": "impact-results-addresses-persona-gap",
  "type": "addresses",
  "from": "urn:change-saga:app:fragment:evidence-traversal-map:landmark:impact-results",
  "to": "urn:change-saga:app:story:evidence-traversal:criterion:persona-gap",
  "scope": "self",
  "rationale": "The impact result also exposes an active persona that has no accepted story.",
  "to_revision": "urn:change-saga:app:story:evidence-traversal:revision:r2",
  "from_content_digest": "sha256:764d7296c05733b8e34eda993e69331d6c03134c99f77ef88638fefaf805d70d",
  "state": "active",
  "created_at": "2026-09-21T04:54:41.044685Z"
}
