{
  "$schema": "https://changesaga.dev/schema/v5/relation.schema.json",
  "version": 5,
  "id": "revision-state-explains-conflicts",
  "type": "explains",
  "from": "urn:change-saga:change-saga:slide:revision-conflict-state",
  "to": "urn:change-saga:change-saga:story:parallel-authoring:criterion:conflicts",
  "scope": "descendants",
  "rationale": "The state machine shows that concurrent heads remain visible and no winner is synthesized until an author reconciles all heads.",
  "to_revision": "urn:change-saga:change-saga:story:parallel-authoring:revision:r1",
  "state": "superseded",
  "created_at": "2026-09-23T03:22:25.942119Z",
  "superseded_at": "2026-09-23T16:39:35.170137Z"
}
