{
  "$schema": "https://changesaga.dev/schema/v5/relation.schema.json",
  "version": 5,
  "id": "thread-lifecycle-explains-contextual-comments",
  "type": "explains",
  "from": "urn:change-saga:change-saga:slide:thread-lifecycle",
  "to": "urn:change-saga:change-saga:story:contextual-comments",
  "scope": "descendants",
  "rationale": "The state machine explains how comments and replies remain anchored to one review element while their thread state is derived.",
  "to_revision": "urn:change-saga:change-saga:story:contextual-comments:revision:r2",
  "state": "active",
  "created_at": "2026-09-23T03:26:50.721609Z"
}
