{
  "$schema": "https://changesaga.dev/schema/v5/relation.schema.json",
  "version": 5,
  "id": "impl-structured-explains-inert",
  "type": "explains",
  "from": "urn:change-saga:app:slide:coverage-and-policy:item:structured-reads",
  "to": "urn:change-saga:app:story:bounded-automation:criterion:inert-content",
  "scope": "self",
  "rationale": "The structured-reads Item explains inert content reads and pins their adversarial test.",
  "to_revision": "urn:change-saga:app:story:bounded-automation:revision:r2",
  "state": "active",
  "created_at": "2026-09-21T05:16:54.383401Z",
  "request_id": "impl-structured-explains-inert"
}
