{
  "$schema": "https://changesaga.dev/schema/v5/relation.schema.json",
  "version": 5,
  "id": "preserve-claim-verification-history-verifies-claim-target",
  "type": "verifies",
  "from": "urn:change-saga:app:test-case:preserve-claim-verification-history",
  "to": "urn:change-saga:app:story:claims-verification:criterion:claim-target",
  "scope": "self",
  "rationale": "The case requires the claim to identify the explanation target it qualifies.",
  "from_revision": "urn:change-saga:app:test-case:preserve-claim-verification-history:revision:r1",
  "to_revision": "urn:change-saga:app:story:claims-verification:revision:r2",
  "state": "active",
  "created_at": "2026-09-21T05:52:12.146627Z"
}
