{
  "$schema": "https://changesaga.dev/schema/v5/relation.schema.json",
  "version": 5,
  "id": "test-inventory-selected-code-roundtrip-83349c96e2e9",
  "type": "verifies",
  "from": "urn:change-saga:change-saga:test-case:inventory-selected-code-roundtrip",
  "to": "urn:change-saga:change-saga:story:inventory-scoped-deck-coverage:criterion:selected-subset",
  "scope": "self",
  "rationale": "Steps selected define how this criterion is checked. Implementation links describe only the code they cite; this relation makes no execution claim.",
  "from_revision": "urn:change-saga:change-saga:test-case:inventory-selected-code-roundtrip:revision:r1",
  "to_revision": "urn:change-saga:change-saga:story:inventory-scoped-deck-coverage:revision:r2",
  "state": "active",
  "created_at": "2026-10-16T23:21:05.690044Z",
  "request_id": "test-inventory-selected-code-roundtrip-83349c96e2e9"
}
