{
  "$schema": "https://changesaga.dev/schema/v5/relation.schema.json",
  "version": 5,
  "id": "atomic-replacement-addresses-atomic-repair",
  "type": "addresses",
  "from": "urn:change-saga:app:fragment:evidence-currency-repair:landmark:atomic-replacement",
  "to": "urn:change-saga:app:story:evidence-repair:criterion:atomic-repair",
  "scope": "self",
  "rationale": "The repair preview and confirmation replace one record atomically or preserve the original unchanged.",
  "to_revision": "urn:change-saga:app:story:evidence-repair:revision:r1",
  "from_content_digest": "sha256:92b9326f6325e3fc5cf427fef7e24766da6d6fa91b2849f6937e53a1804ccedd",
  "state": "active",
  "created_at": "2026-09-21T04:52:38.874837Z"
}
