{
  "$schema": "https://changesaga.dev/schema/v5/relation.schema.json",
  "version": 5,
  "id": "impl-prototypes-explains-local-prototype",
  "type": "explains",
  "from": "urn:change-saga:app:slide:knowledge-lifecycle:item:prototypes",
  "to": "urn:change-saga:app:story:prototype-feedback:criterion:local-prototype",
  "scope": "self",
  "rationale": "The prototypes implementation realizes the local-prototype obligation represented by the prototype-loop design landmark.",
  "to_revision": "urn:change-saga:app:story:prototype-feedback:revision:r1",
  "state": "active",
  "created_at": "2026-09-21T05:14:05.358155Z"
}
