{
  "$schema": "https://changesaga.dev/schema/v5/relation.schema.json",
  "version": 5,
  "id": "comparison-architecture-explains-ai-contract",
  "type": "explains",
  "from": "urn:change-saga:change-saga:slide:comparison-architecture",
  "to": "urn:change-saga:change-saga:story:structured-ai-contract",
  "scope": "descendants",
  "rationale": "The architecture shows how the stable query contract is built from one source comparison and evidence index.",
  "to_revision": "urn:change-saga:change-saga:story:structured-ai-contract:revision:r1",
  "state": "active",
  "created_at": "2026-09-23T03:24:25.815671Z"
}
