{
  "$schema": "https://changesaga.dev/schema/v5/relation.schema.json",
  "version": 5,
  "id": "test-inventory-unreferenced-choice-4805e6a3ccb3",
  "type": "verifies",
  "from": "urn:change-saga:change-saga:test-case:inventory-unreferenced-choice",
  "to": "urn:change-saga:change-saga:story:inventory-reconcile-unreferenced:criterion:ask-user",
  "scope": "self",
  "rationale": "Steps existing-choice, unknown define how this criterion is checked. Implementation links describe only the code they cite; this relation makes no execution claim.",
  "from_revision": "urn:change-saga:change-saga:test-case:inventory-unreferenced-choice:revision:r1",
  "to_revision": "urn:change-saga:change-saga:story:inventory-reconcile-unreferenced:revision:r2",
  "state": "active",
  "created_at": "2026-10-16T23:21:09.36872Z",
  "request_id": "test-inventory-unreferenced-choice-4805e6a3ccb3"
}
