{
  "$schema": "https://changesaga.dev/schema/v5/relation.schema.json",
  "version": 5,
  "id": "test-inventory-all-kind-context-matrix-214493c6627c",
  "type": "verifies",
  "from": "urn:change-saga:change-saga:test-case:inventory-all-kind-context-matrix",
  "to": "urn:change-saga:change-saga:story:inventory-query-technical-context:criterion:filter-proposed",
  "scope": "self",
  "rationale": "Steps filters define how this criterion is checked. Implementation links describe only the code they cite; this relation makes no execution claim.",
  "from_revision": "urn:change-saga:change-saga:test-case:inventory-all-kind-context-matrix:revision:r1",
  "to_revision": "urn:change-saga:change-saga:story:inventory-query-technical-context:revision:r2",
  "state": "active",
  "created_at": "2026-10-16T23:21:23.382448Z",
  "request_id": "test-inventory-all-kind-context-matrix-214493c6627c"
}
