{
  "$schema": "https://changesaga.dev/schema/v5/relation.schema.json",
  "version": 5,
  "id": "test-inventory-definition-query-836a52cc781a",
  "type": "verifies",
  "from": "urn:change-saga:change-saga:test-case:inventory-definition-query",
  "to": "urn:change-saga:change-saga:story:inventory-compose-designs:criterion:code-grounding",
  "scope": "self",
  "rationale": "Steps link, drift define how this criterion is checked. Implementation links describe only the code they cite; this relation makes no execution claim.",
  "from_revision": "urn:change-saga:change-saga:test-case:inventory-definition-query:revision:r1",
  "to_revision": "urn:change-saga:change-saga:story:inventory-compose-designs:revision:r2",
  "state": "active",
  "created_at": "2026-10-16T23:20:09.766925Z",
  "request_id": "test-inventory-definition-query-836a52cc781a"
}
