{
  "$schema": "https://changesaga.dev/schema/v5/relation.schema.json",
  "version": 5,
  "id": "story-lifecycle-and-retirement-history-verifies-lifecycle",
  "type": "verifies",
  "from": "urn:change-saga:app:test-case:story-lifecycle-and-retirement-history",
  "to": "urn:change-saga:app:story:evolve-product-knowledge:criterion:lifecycle",
  "scope": "self",
  "rationale": "The story-lifecycle-and-retirement-history case directly checks the lifecycle acceptance obligation.",
  "from_revision": "urn:change-saga:app:test-case:story-lifecycle-and-retirement-history:revision:r1",
  "to_revision": "urn:change-saga:app:story:evolve-product-knowledge:revision:r1",
  "state": "active",
  "created_at": "2026-09-21T05:55:46.581825Z",
  "request_id": "qpk-link-story-lifecycle-and-retirement-history-lifecycle"
}
