{
  "$schema": "https://changesaga.dev/schema/v5/relation.schema.json",
  "version": 5,
  "id": "coordination-resumption-addresses-progress",
  "type": "addresses",
  "from": "urn:change-saga:app:fragment:bounded-coordination:landmark:coordination-resumption",
  "to": "urn:change-saga:app:story:parallel-delivery-plan:criterion:progress-not-delivery",
  "scope": "self",
  "rationale": "Resumption distinguishes reported progress from immutable delivery evidence.",
  "to_revision": "urn:change-saga:app:story:parallel-delivery-plan:revision:r1",
  "from_content_digest": "sha256:1401faa01ef458edc8d6bc853754d7c64c177e95ffa225c18f5bfa4a1247a84c",
  "state": "active",
  "created_at": "2026-09-21T04:51:36.574359Z"
}
