{
  "$schema": "https://changesaga.dev/schema/v5/relation.schema.json",
  "version": 5,
  "id": "test-inventory-erd-entity-meaning-2a1ee2d0863f",
  "type": "verifies",
  "from": "urn:change-saga:change-saga:test-case:inventory-erd-entity-meaning",
  "to": "urn:change-saga:change-saga:story:erd-entity-context:criterion:structure-and-resource",
  "scope": "self",
  "rationale": "Steps record, payload define how this criterion is checked. Implementation links describe only the code they cite; this relation makes no execution claim.",
  "from_revision": "urn:change-saga:change-saga:test-case:inventory-erd-entity-meaning:revision:r1",
  "to_revision": "urn:change-saga:change-saga:story:erd-entity-context:revision:r2",
  "state": "active",
  "created_at": "2026-10-16T23:06:29.720209Z",
  "request_id": "test-inventory-erd-entity-meaning-2a1ee2d0863f"
}
