{
  "$schema": "https://changesaga.dev/schema/v5/relation.schema.json",
  "version": 5,
  "id": "test-core-requirement-ownership-5c2d2cfb0c72",
  "type": "verifies",
  "from": "urn:change-saga:change-saga:test-case:core-requirement-ownership",
  "to": "urn:change-saga:change-saga:story:requirements-feature-scope:criterion:feature-in-query",
  "scope": "self",
  "rationale": "Steps check-feature-in-query define how this criterion is checked. Implementation links describe only the code they cite; this relation makes no execution claim.",
  "from_revision": "urn:change-saga:change-saga:test-case:core-requirement-ownership:revision:r1",
  "to_revision": "urn:change-saga:change-saga:story:requirements-feature-scope:revision:r2",
  "state": "active",
  "created_at": "2026-10-16T23:16:59.37192Z",
  "request_id": "test-core-requirement-ownership-5c2d2cfb0c72"
}
